{
  "schema_version": "1.0",
  "result_id": "vr-d0c0e440c467f446",
  "run_id": "d0c0e440c467f446",
  "plan_id": "plan-d0c0e440c467f446",
  "overall": "PASS",
  "checks": [
    {
      "name": "mutation_applied",
      "status": "pass",
      "reason": "1 mutation(s) applied."
    },
    {
      "name": "good_tree_integrity",
      "status": "pass",
      "reason": "good/counter.c is byte-identical to the original source."
    },
    {
      "name": "bad_tree_changed",
      "status": "pass",
      "reason": "bad/counter.c contains the expected mutation and differs from good/."
    },
    {
      "name": "mutation_scope",
      "status": "pass",
      "reason": "Exactly 1 file changed: counter.c"
    },
    {
      "name": "simple_syntax_sanity",
      "status": "pass",
      "reason": "Mutated line 41 has balanced parentheses."
    }
  ]
}
