{
  "schema_version": "1.0",
  "result_id": "vr-60b9f639c741c827",
  "run_id": "60b9f639c741c827",
  "plan_id": "plan-60b9f639c741c827",
  "overall": "PASS",
  "checks": [
    {
      "name": "mutation_applied",
      "status": "pass",
      "reason": "1 mutation(s) applied."
    },
    {
      "name": "good_tree_integrity",
      "status": "pass",
      "reason": "good/graph.c is byte-identical to the original source."
    },
    {
      "name": "bad_tree_changed",
      "status": "pass",
      "reason": "bad/graph.c contains the expected mutation and differs from good/."
    },
    {
      "name": "mutation_scope",
      "status": "pass",
      "reason": "Exactly 1 file changed: graph.c"
    },
    {
      "name": "simple_syntax_sanity",
      "status": "pass",
      "reason": "Mutated line 264 has balanced parentheses."
    }
  ]
}
