{
  "schema_version": "1.0",
  "result_id": "vr-ec50a5df4806aca9",
  "run_id": "ec50a5df4806aca9",
  "plan_id": "plan-ec50a5df4806aca9",
  "overall": "PASS",
  "checks": [
    {
      "name": "mutation_applied",
      "status": "pass",
      "reason": "1 mutation(s) applied."
    },
    {
      "name": "good_tree_integrity",
      "status": "pass",
      "reason": "good/strvec.c is byte-identical to the original source."
    },
    {
      "name": "bad_tree_changed",
      "status": "pass",
      "reason": "bad/strvec.c contains the expected mutation and differs from good/."
    },
    {
      "name": "mutation_scope",
      "status": "pass",
      "reason": "Exactly 1 file changed: strvec.c"
    },
    {
      "name": "simple_syntax_sanity",
      "status": "pass",
      "reason": "Mutated line 37 has balanced parentheses."
    }
  ]
}
