{
  "schema_version": "1.0",
  "result_id": "vr-5fb65ac3a7052507",
  "run_id": "5fb65ac3a7052507",
  "plan_id": "plan-5fb65ac3a7052507",
  "overall": "PASS",
  "checks": [
    {
      "name": "mutation_applied",
      "status": "pass",
      "reason": "1 mutation(s) applied."
    },
    {
      "name": "good_tree_integrity",
      "status": "pass",
      "reason": "good/kvstore.c is byte-identical to the original source."
    },
    {
      "name": "bad_tree_changed",
      "status": "pass",
      "reason": "bad/kvstore.c contains the expected mutation and differs from good/."
    },
    {
      "name": "mutation_scope",
      "status": "pass",
      "reason": "Exactly 1 file changed: kvstore.c"
    },
    {
      "name": "simple_syntax_sanity",
      "status": "pass",
      "reason": "Mutated line 40 has balanced parentheses."
    }
  ]
}
