{
  "schema_version": "1.0",
  "result_id": "vr-b58612ccecb7704c",
  "run_id": "b58612ccecb7704c",
  "plan_id": "plan-b58612ccecb7704c",
  "overall": "PASS",
  "checks": [
    {
      "name": "mutation_applied",
      "status": "pass",
      "reason": "1 mutation(s) applied."
    },
    {
      "name": "good_tree_integrity",
      "status": "pass",
      "reason": "good/arena.c is byte-identical to the original source."
    },
    {
      "name": "bad_tree_changed",
      "status": "pass",
      "reason": "bad/arena.c contains the expected mutation and differs from good/."
    },
    {
      "name": "mutation_scope",
      "status": "pass",
      "reason": "Exactly 1 file changed: arena.c"
    },
    {
      "name": "simple_syntax_sanity",
      "status": "pass",
      "reason": "Mutated line 32 has balanced parentheses."
    }
  ]
}
