{
  "schema_version": "1.0",
  "result_id": "vr-3651af04f158a0bf",
  "run_id": "3651af04f158a0bf",
  "plan_id": "plan-3651af04f158a0bf",
  "overall": "PASS",
  "checks": [
    {
      "name": "mutation_applied",
      "status": "pass",
      "reason": "1 mutation(s) applied."
    },
    {
      "name": "good_tree_integrity",
      "status": "pass",
      "reason": "good/ringbuf.c is byte-identical to the original source."
    },
    {
      "name": "bad_tree_changed",
      "status": "pass",
      "reason": "bad/ringbuf.c contains the expected mutation and differs from good/."
    },
    {
      "name": "mutation_scope",
      "status": "pass",
      "reason": "Exactly 1 file changed: ringbuf.c"
    },
    {
      "name": "simple_syntax_sanity",
      "status": "pass",
      "reason": "Mutated line 33 has balanced parentheses."
    }
  ]
}
